{
  "project": {
    "course_name": "Generic Course",
    "module_code": "GENERIC",
    "target_group_key": "generic_current",
    "exam_year": "2026",
    "output_folder": "tests/tmp/generic_output"
  },
  "source_inputs": {
    "lecture_slides": ["tests/fixtures/control_plane/fake_lecture.txt"],
    "official_notes": [],
    "formal_past_papers": ["tests/fixtures/control_plane/fake_paper.txt"],
    "practical_materials": [],
    "mocks_quizzes_answer_keys": [],
    "exemplars_or_feedback": [],
    "extra_reading_books_or_papers": []
  },
  "source_policy": {
    "allow_online_academic_search": true,
    "allow_extra_reading_enrichment": true,
    "require_verified_citations": true,
    "treat_examples_as_style_only": true
  },
  "output_mode": {
    "preset": "exam_format_diagnosis",
    "include_audit_package": false,
    "student_visible_only": true,
    "requested_artifacts": ["chat-only exam analysis brief"]
  },
  "qa": {
    "strict_publish_gate": true,
    "require_lineage": true,
    "run_language_lint": true,
    "run_ontology_validator": true,
    "fail_on_blocking_flags": true
  },
  "advanced": {
    "reuse_existing_intermediates": true,
    "rebuild_fragment_index": "auto",
    "clean_stale_generated_outputs": false
  }
}
